segment_name,segment_description,age_range,income_level,location,tech_comfort,lifestyle,key_motivations,persona_count
Tech-Savvy Millennials,"Young professionals aged 25-35 who are early adopters of technology and value efficiency and innovation.",25-35,Upper middle class,Urban Germany,High,"Fast-paced, career-focused, values convenience and innovation","Efficiency, Innovation, Career advancement",5
Budget-Conscious Families,"Families with children who prioritize value for money and practical solutions for everyday challenges.",30-45,Middle class,Suburban Germany,Medium,"Family-oriented, practical, budget-conscious, values reliability","Family wellbeing, Value for money, Practicality",5
Premium Service Seekers,"Affluent customers who are willing to pay premium prices for high-quality products and exceptional service.",40-60,High income,Major German cities,Medium,"Luxury-oriented, quality-focused, values exclusivity and personal service","Quality, Status, Exclusivity",3
Digital Natives,"Gen Z and younger millennials who grew up with digital technology and expect seamless digital experiences.",18-30,Lower to middle class,Urban and suburban Germany,Very High,"Social media savvy, environmentally conscious, values authenticity and social impact","Sustainability, Social impact, Authenticity, Digital convenience",4
Senior Tech Adopters,"Older adults who are increasingly comfortable with technology and value products that enhance their quality of life.",55-75,Middle to high income,Mixed urban and rural Germany,Low to Medium,"Health-conscious, values simplicity and reliability, focuses on family and leisure","Health and wellness, Simplicity, Family connection, Security",3
Small Business Owners,"Entrepreneurs and small business owners who need efficient solutions to grow their businesses.",30-50,Variable income,Mixed locations across Germany,Medium to High,"Results-driven, time-conscious, values ROI and practical solutions","Business growth, Efficiency, Cost-effectiveness, Time savings",4
GfK Trend Surfers,"Health and fitness-conscious consumers who value social recognition and staying current with trends. They are active, social, and image-conscious.",25-45,Middle to upper middle income,Urban areas,High,"Active, health-conscious, trend-aware, socially engaged, image-focused","Social recognition, Health and fitness, Trends, Social status, Appearance",4
GfK Alphas,"Traditional and ambitious consumers who value hard work, achievement, and conventional success. They are confident leaders who believe in traditional values.",35-65,Upper middle to high income,Urban and suburban areas,Medium,"Traditional, achievement-oriented, status-conscious, values hierarchy and conventional success","Achievement, Status, Leadership, Traditional values, Recognition",4
Sinus Performer,"Success-oriented efficiency milieu focused on career advancement and material success. They are competitive, ambitious, and technology-savvy.",25-50,High income,Major urban centers,Very High,"Career-focused, competitive, efficiency-oriented, technology-savvy, status-conscious","Career success, Efficiency, Competition, Status, Innovation",4
Sinus Socio-ecological,"Environmentally and socially conscious milieu that prioritizes sustainability and social responsibility. They value authentic, ethical consumption.",25-55,Middle to upper middle income,Progressive urban and rural communities,Medium to High,"Environmentally conscious, socially responsible, values authenticity and sustainability","Sustainability, Social responsibility, Authenticity, Environmental protection, Ethical consumption",4
zero360 Junge Berufsstarter,"Junge Erwachsene zwischen 20-29 Jahren in den ersten Berufsjahren. Erstes regelmäßiges Einkommen, leben urban, nutzen alle digitalen Kanäle selbstverständlich.",20-29,"Niedrig bis Mittel (€25.000 - €45.000)","Großstädte, urbane Zentren",Sehr hoch,"Digital Native, WG-Leben oder erste eigene Wohnung, hohe Social Media Nutzung, experimentierfreudig bei Marken","Karriereentwicklung, Unabhängigkeit, Soziale Anerkennung, Neue Erfahrungen, Preis-Leistung",5
zero360 Premium-Käufer,"Konsumenten mit hoher Kaufkraft und Luxuspräferenz. Qualität und Exklusivität vor Preis. Markentreu, erwarten exzellenten Service und besondere Einkaufserlebnisse.",30-70,"Sehr hoch (€100.000+)","Beste Lagen, Großstädte",Hoch,"Luxusmarken, Statussymbole, Business Class, Premium-Services, Kunst und Kultur, Gourmet-Restaurants","Exklusivität, Prestige, Qualität, Service, Individualität",3
zero360 Umweltbewusste Millennials,"Starkes Umweltbewusstsein, reduzieren ökologischen Fußabdruck. Second-Hand und Sharing selbstverständlich. Unterstützen Purpose-Brands.",28-40,"Mittel (€35.000 - €65.000)","Großstädte, Szeneviertel",Hoch,"Second-Hand, Sharing Economy, Veggie/Vegan, Fahrrad/ÖPNV, Zero Waste, Aktivismus, Social Media für Causes","Nachhaltigkeit, Klimaschutz, Fairness, Authentizität, Minimalismus",4
zero360 Hybride Arbeiter,"Flexibles Arbeitsmodell Home-Office/Büro. Schätzen Flexibilität, investieren in Home-Office. Work-Life-Integration statt Trennung.",25-55,"Mittel bis Hoch (€40.000 - €85.000)","Städte und Umland",Hoch,"Home-Office Setup, Collaboration Tools, Flexible Zeiten, Coworking, Digital Nomad Tendenz","Flexibilität, Work-Life-Integration, Produktivität, Autonomie, Balance",4
