segment_name,segment_description,age_range,income_level,location,tech_comfort,lifestyle,key_motivations,persona_count
Junge Berufsstarter,"Junge Erwachsene zwischen 20-29 Jahren in den ersten Berufsjahren. Erstes regelmäßiges Einkommen, leben urban, nutzen alle digitalen Kanäle selbstverständlich. Experimentierfreudig bei neuen Marken und Services, steigendes Budget.",20-29,"Niedrig bis Mittel (€25.000 - €45.000)","Großstädte, urbane Zentren",Sehr hoch,"Digital Native, WG-Leben oder erste eigene Wohnung, hohe Social Media Nutzung, experimentierfreudig bei Marken, Ausgehen und Networking wichtig, Work-Life-Balance suchend","Karriereentwicklung, Unabhängigkeit, Soziale Anerkennung, Neue Erfahrungen, Preis-Leistung",5
Etablierte Familien,"Familien mit schulpflichtigen Kindern, meist verheiratet, beruflich etabliert. Stabiles Haushaltseinkommen, oft Wohneigentum. Kaufentscheidungen geprägt von Sicherheit, Qualität und Familientauglichkeit.",35-45,"Mittel bis Hoch (€60.000 - €120.000 Haushalt)","Vororte, Mittelstädte, Speckgürtel",Mittel bis Hoch,"Eigenheim oder große Mietwohnung, 2-3 Kinder, beruflich etabliert, Auto essentiell, Familienurlaube, Vereinsaktivitäten, strukturierter Alltag","Sicherheit, Qualität, Familienfreundlichkeit, Bildung der Kinder, Langfristige Planung",5
Best Ager,"Generation 50-65 auf Karrierehöhepunkt oder kurz vor Ruhestand. Hohes verfügbares Einkommen, qualitätsbewusst, markentreu. Gesundheit und Fitness wichtig, zunehmend digital aktiv.",50-65,"Hoch (€70.000 - €150.000+)","Gehobene Wohngebiete, Stadtrand",Mittel,"Kinder aus dem Haus, Reisefreudig, Kulturinteressiert, Markentreu, Gesundheitsbewusst, Qualität vor Preis, Zeit für Hobbys","Qualität, Gesundheit, Komfort, Genuss, Status",4
Aktive Senioren,"Vitale Rentner über 65, aktive Ruhestandsgestaltung. Zeit und finanzielle Mittel vorhanden. Gesundheit zentral, soziale Kontakte wichtig, wachsende Digitalnutzung besonders Tablets.",65+,"Mittel bis Hoch (Rente + Vermögen)","Etablierte Wohngebiete, Kleinstädte",Niedrig bis Mittel,"Viel Zeit verfügbar, Ehrenamt, Vereinsaktiv, Großeltern-Rolle, Gesundheitsvorsorge, Traditionsbewusst, Persönliche Beratung bevorzugt","Gesundheit, Soziale Kontakte, Sicherheit, Tradition, Enkelkinder",4
Generation Z,"Jüngste Konsumentengeneration, mit Internet aufgewachsen. Permanent online, Social Media zentral. Nachhaltigkeit und Purpose wichtig, kritisch gegenüber traditionellen Marken.",16-24,"Niedrig (Taschengeld bis €30.000)","Überall, digital vernetzt",Sehr hoch,"Always-on, TikTok/Instagram native, Streaming statt TV, Gaming, Influencer-orientiert, Umweltbewusst, Diversität wichtig","Authentizität, Nachhaltigkeit, Individualität, Soziale Gerechtigkeit, Instant Gratification",5
Premium-Käufer,"Konsumenten mit hoher Kaufkraft und Luxuspräferenz. Qualität und Exklusivität vor Preis. Markentreu, erwarten exzellenten Service und besondere Einkaufserlebnisse.",30-70,"Sehr hoch (€100.000+)","Beste Lagen, Großstädte",Hoch,"Luxusmarken, Statussymbole, Business Class, Premium-Services, Kunst und Kultur, Gourmet-Restaurants, Persönlicher Service","Exklusivität, Prestige, Qualität, Service, Individualität",3
Schnäppchenjäger,"Preisbewusste Konsumenten, aktiv auf Schnäppchensuche. Nutzen Preisvergleiche, Gutscheine, planen um Sales. Geringe Markentreue, Preis wichtigstes Kriterium.",25-65,"Niedrig bis Mittel (€20.000 - €50.000)",Überall,Mittel bis Hoch,"Gutschein-Sammler, Sale-Shopping, Preisvergleiche, Discounter-Käufer, Second-Hand, Cashback-Nutzer, Newsletter-Abonnent","Sparen, Schnäppchen, Clever kaufen, Mehr für weniger, Preisvergleich",5
Early Adopter,"Technologiebegeisterte Erstkäufer neuer Produkte. Risikobereit, Meinungsführer, beeinflussen soziales Umfeld. Gut informiert über Neuheiten, überdurchschnittliches Einkommen.",25-45,"Mittel bis Hoch (€50.000 - €100.000)","Großstädte, Tech-Hubs",Sehr hoch,"Tech-Gadgets, Crowdfunding-Backer, Beta-Tester, Tech-Blogs, Messen und Events, Opinion Leader, Social Media aktiv","Innovation, Erste sein, Technologie, Status, Einfluss",4
Bio-Käufer,"Fokus auf biologische und nachhaltige Produkte. Achten auf Herkunft und Produktionsbedingungen. Bereit für Mehrpreise, oft überdurchschnittlich gebildet, urban.",25-60,"Mittel bis Hoch (€40.000 - €80.000)","Städte, gehobene Viertel",Mittel,"Bio-Supermärkte, Wochenmarkt, Unverpackt-Läden, Yoga/Meditation, Fair Trade, Vegetarisch/Vegan-Tendenz, Naturkosmetik","Gesundheit, Nachhaltigkeit, Tierwohl, Regionalität, Umweltschutz",4
Online-First-Shopper,"Großteil der Einkäufe online. Versiert mit E-Commerce, nutzen Vergleichsportale und Bewertungen. Schätzen 24/7 Verfügbarkeit und bequeme Lieferung.",20-50,"Mittel (€35.000 - €70.000)","Überall, urban geprägt",Sehr hoch,"Amazon Prime, Click & Collect, Mobile Shopping, Bewertungen wichtig, Retouren normal, Vergleichsportale, Newsletter","Convenience, Auswahl, Zeitersparnis, Vergleichbarkeit, Bewertungen",4
Umweltbewusste Millennials,"Starkes Umweltbewusstsein, reduzieren ökologischen Fußabdruck. Second-Hand und Sharing selbstverständlich. Unterstützen Purpose-Brands, boykottieren Umweltsünder.",28-40,"Mittel (€35.000 - €65.000)","Großstädte, Szeneviertel",Hoch,"Second-Hand, Sharing Economy, Veggie/Vegan, Fahrrad/ÖPNV, Zero Waste, Aktivismus, Social Media für Causes","Nachhaltigkeit, Klimaschutz, Fairness, Authentizität, Minimalismus",4
Karriereorientierte Singles,"Beruflich ambitionierte Singles, Fokus auf Karriere. Zeit knapper als Geld, hohe Affinität zu Convenience. Fitness und Selbstoptimierung wichtig.",25-40,"Mittel bis Hoch (€45.000 - €90.000)","Großstädte, Zentrum",Sehr hoch,"Lange Arbeitszeiten, Convenience-Services, Fitness/Gym, Business-Kleidung, After-Work, Weiterbildung, Lieferdienste","Karriere, Effizienz, Selbstoptimierung, Networking, Status",4
Traditionelle Wertkonservative,"Traditionelle Werte, konservativer Lebensstil. Leben oft ländlich, vereinsaktiv, regional verwurzelt. Bevorzugen lokale Händler und persönliche Beziehungen.",40-75,"Niedrig bis Mittel (€30.000 - €60.000)","Ländlicher Raum, Kleinstädte",Niedrig,"Vereinsaktiv, Regional verwurzelt, Lokale Händler, Persönlicher Kontakt, Skeptisch bei Neuem, Familie wichtig, Handwerk geschätzt","Tradition, Heimat, Sicherheit, Beständigkeit, Vertrauen",5
Kreative Kulturinteressierte,"Kulturaffine mit alternativem Lebensstil. Leben urban in Szenevierteln. Kunst und Kreativität zentral, unterstützen lokale Künstler, Individualität wichtiger als Mainstream.",25-55,"Mittel (€30.000 - €60.000)","Großstädte, Szeneviertel",Hoch,"Kunst/Galerien, Indie-Kinos, Konzerte, Alternative Szene, Vintage/Unique, Cafés/Bars, DIY-Projekte","Kreativität, Kultur, Individualität, Authentizität, Inspiration",4
Gesundheitsbewusste Sportler,"Hohes Gesundheits- und Fitnessbewusstsein. Sport als Alltag, tracken Aktivitäten mit Wearables. Investieren in Gesundheit, nehmen an Events teil.",20-55,"Mittel bis Hoch (€40.000 - €80.000)","Überall, Nähe zu Sportmöglichkeiten",Hoch,"Fitnessstudio, Laufen/Radfahren, Sportequipment, Supplements, Wearables, Sportevents, Ernährungsbewusst","Fitness, Gesundheit, Leistung, Wohlbefinden, Prävention",4
Großstadt-Hipster,"Trendbewusste Großstädter in Metropolen. Szeneorientiert, oft in Kreativ/Digital-Branche. International, setzen Trends, Social Media intensiv.",25-40,"Mittel (€35.000 - €65.000)","Berlin, Hamburg, München, Köln",Sehr hoch,"Craft Beer/Coffee, Street Food, Vintage Fashion, Startups, Instagram, Pop-ups, Coworking, Urban Mobility","Trends, Individualität, Authentizität, Kreativität, Szene",4
Mittelstadt-Familien,"Familien in mittelgroßen Städten. Schätzen überschaubare Größe und Gemeinschaft. Regional verwurzelt, unterstützen lokale Unternehmen.",30-50,"Mittel (€40.000 - €70.000 Haushalt)","Städte 50.000-200.000 Einwohner",Mittel,"Vereinsleben, Lokale Events, Regionale Händler, Bodenständig, Nachbarschaft, Stadtfeste, Ehrenamt","Familie, Sicherheit, Gemeinschaft, Tradition, Regionalität",5
Pendler aus dem Speckgürtel,"Wohnen im Umland, arbeiten in Großstadt. Bewusste Entscheidung für mehr Raum und Grün. Balance zwischen Karriere und Familie wichtig.",30-55,"Mittel bis Hoch (€50.000 - €90.000)","Umland von Großstädten",Mittel bis Hoch,"Auto essentiell, Eigenheim mit Garten, Pendelzeit, Online-Shopping, Wochenend-Familie, Suburban Lifestyle","Work-Life-Balance, Wohnqualität, Familie, Natur, Ruhe",4
Ländliche Bevölkerung,"Bewohner ländlicher Gebiete. Starke Dorfgemeinschaft, traditionelle Werte. Unterstützen lokale Händler, Digitalisierung kommt langsamer an.",30-70,"Niedrig bis Mittel (€25.000 - €50.000)","Dörfer, ländliche Gebiete",Niedrig,"Dorfgemeinschaft, Direktvermarkter, Handwerk, Selbstversorgung, Nachbarschaftshilfe, Feste/Bräuche, Natur","Gemeinschaft, Tradition, Selbstversorgung, Natur, Ruhe",4
LOHAS,"Lifestyle of Health and Sustainability. Ganzheitliches Gesundheitsbewusstsein, Yoga/Meditation Standard. Konsumieren bewusst, Meinungsführer für nachhaltigen Lifestyle.",30-60,"Mittel bis Hoch (€45.000 - €85.000)","Städte, gehobene Viertel",Mittel bis Hoch,"Yoga/Meditation, Bio-Ernährung, Naturkosmetik, Faire Mode, Alternative Medizin, Spiritualität, Bewusster Konsum","Ganzheitlichkeit, Gesundheit, Nachhaltigkeit, Achtsamkeit, Balance",4
DINKS,"Double Income No Kids - Paare ohne Kinder. Hohes verfügbares Einkommen, können sich Luxus leisten. Genießen Freiheit und Flexibilität.",30-45,"Hoch (€80.000 - €150.000 Haushalt)","Großstädte, beste Lagen",Hoch,"Spontane Reisen, Fine Dining, Design/Kunst, Premium-Produkte, Flexibilität, Kultur/Events, Luxus-Services","Genuss, Freiheit, Luxus, Karriere, Erlebnisse",3
Heavy User Digitale Services,"Intensive Nutzer digitaler Services. Multiple Abos, Smart Home, Gaming wichtig. Always-on, erwarten nahtlose digitale Experiences.",18-45,"Mittel (€35.000 - €70.000)","Urban, Tech-affin",Sehr hoch,"Multiple Streaming-Abos, Smart Home, Gaming, Cloud-Services, Always-on, Early Adopter, Paperless","Innovation, Convenience, Unterhaltung, Vernetzung, Effizienz",4
DIY-Enthusiasten,"Leidenschaft fürs Selbermachen. Renovieren selbst, YouTube-Tutorials wichtig. Regelmäßige Baumarkt-Besucher, stolz auf Selbstgeschaffenes.",30-65,"Mittel (€35.000 - €65.000)","Überall, eigenes Heim",Mittel bis Hoch,"Heimwerken, YouTube-Tutorials, Baumarkt-Kunde, Werkzeug-Sammlung, Maker-Spaces, Repair-Cafés, Projekt-Sharing","Selbstverwirklichung, Kreativität, Sparen, Stolz, Nachhaltigkeit",4
Haustierbesitzer,"Haustiere als Familienmitglieder. Starke emotionale Bindung, investieren viel in Wohlbefinden. Premium-Produkte, Versicherungen selbstverständlich.",25-70,"Mittel (€35.000 - €70.000)",Überall,Mittel,"Premium-Tierfutter, Tierarzt-Regular, Pet-Versicherungen, Tierspielzeug, Tierpension, Social Media Pets, Tier-Community","Tierliebe, Fürsorge, Begleitung, Verantwortung, Freude",4
Hybride Arbeiter,"Flexibles Arbeitsmodell Home-Office/Büro. Schätzen Flexibilität, investieren in Home-Office. Work-Life-Integration statt Trennung.",25-55,"Mittel bis Hoch (€40.000 - €85.000)","Städte und Umland",Hoch,"Home-Office Setup, Collaboration Tools, Flexible Zeiten, Coworking, Digital Nomad Tendenz, Selbstorganisation","Flexibilität, Work-Life-Integration, Produktivität, Autonomie, Balance",4
